Title,Time,Author,Content
us futures fall as week of battering by yields nears end: stock market news today,2023-10-20T11:28:19.000Z,Karen Friar,"us stocks slipped ahead of the bell on friday, with benchmark treasury yields on the retreat after spiking to 5% in the wake of comments by federal reserve chair jerome powell.
dow jones industrial average (^dji) was down about 0.2%, while s&p 500 (^gspc) futures shed around 0.3%, both on track for a losing week after thursday's sell-off. contracts on the tech-heavy nasdaq 100 (^ndx) dropped almost 0.4%.
stocks lost ground after powell signaled the fed is committed to its ""higher for longer"" rates stance, which spurred gains in treasury yields. the benchmark 10-year yield (^tnx) rose briefly to 5% late on thursday, a closely watched level not seen since july 2007.
“the underlying message is 'don’t be looking for a bailout from the fed anytime soon,'” greg whiteley, a portfolio manager at doubleline, told reuters. ""that gives people the go ahead to take rates above 5%.”
on friday, the yield on the 10-year retreated from that key level, dropping to around 4.93%, as part of a broader recovery in fixed-income assets. but the ""pain trade"" in bonds could have further to run, even after weeks of putting pressure on stocks.
investors looking to earnings to lift the downbeat mood have yet to find relief, despite strong financial reports. on the docket thursday are results from american express (axp), comerica (cma), huntington bancshares (hban).
also still weighing on shaky markets is the risk of the israel-hamas war turning into a wider middle east conflict, after israel's defense chief hinted at a ground assault on gaza at the weekend.
us futures pointed friday to a lower open as the 10-year treasury yield pulled back from a spike that took it to 5%.
futures on the dow jones industrial average (^dji) were down 0.21%, or 71 points, while s&p 500 (^gspc) futures dropped 0.30%. contracts on the tech-heavy nasdaq 100 (^ndx) fell 0.39%.
click here for the latest stock market news and in-depth analysis, including events that move stocks
read the latest financial and business news from yahoo finance"
microsoft is now a gaming juggernaut,2023-10-20T19:38:33.000Z,Daniel Howley,"microsoft (msft) officially owns activision blizzard (atvi), making it the third-largest gaming company in the world by revenue behind just tencent and sony (sony). but the acquisition does more than boost microsoft’s standing in the global gaming industry. it gives the company far greater access to the mobile gaming market, lines it up for revenue via mobile games advertising, and provides it with the opportunity to grow its xbox game pass subscription service and xbox cloud gaming streaming service.
“it's certainly a seismic shift in how the money flows around the gaming ecosystem,” explained international data corporation (idc) research director lewis ward. “it is the biggest acquisition in microsoft's history. it is one of the biggest acquisitions in the tech market. it is … by anyone’s measure, a big sea change.”
but don’t expect the company to start reaping the benefits of the $69-billion deal anytime soon. microsoft still has a long way to go before it can begin to put its stamp on any of activision blizzard’s games like “call of duty” and longer still before its bet on cloud gaming pays off.
microsoft has never had much of a hand in the mobile gaming market. and while the console and pc markets are huge, bringing in $43 billion and $40 billion respectively in 2023, the mobile gaming market is even larger. according to a study by data.ai and idc, the segment will bring in a whopping $103 billion this year alone.
but with activision blizzard, microsoft is now one of the biggest players in mobile gaming. activision blizzard’s “candy crush saga” was the second-highest-grossing mobile game in the world in the first half of 2023 behind only tencent’s “honor of kings.” and as of q2 2023, activision blizzard’s king mobile division had an incredible 238 million monthly active users. that’s far more than activision’s 92 million, despite that arm running “call of duty,” or blizzard’s 26 million.
“the amount of revenue that 'candy crush' generates should not be underestimated,” said forrester senior analyst will mckeon-white. “microsoft has also traditionally had a minimal ... mobile gaming presence. so this acquisition also significantly helps out with that.”
that mobile presence also gives microsoft a significant leg up in the mobile advertising space. after all, mobile games generate money via either in-game sales or ads, and “candy crush” does both.
outside of mobile gaming, activision blizzard gives microsoft the firepower it needs to exploit its game pass subscription service and nascent xbox cloud gaming. game pass gives subscribers access to hundreds of games that they can download to their xbox consoles or pcs for $16.99 per month. the service has been a key portion of microsoft’s gaming strategy, with ceo satya nadella regularly calling out the service during the company’s earnings calls.
in january, nadella announced that the service had surpassed 120 million monthly active users. and with activision blizzard’s library of intellectual property, microsoft can make game pass an even more appealing option for gamers, giving the company more firepower to drive subscriptions over time.
then there’s the cloud gaming aspect of the deal. microsoft is the leader in cloud gaming, and has opened up the service to a slew of new devices including smart tvs and even meta’s (meta) quest 3 ar/vr headset. but cloud gaming is still in its early stages. the quality of streams doesn’t always match up to what you’d get playing games on a console or pc, and high-speed internet still isn’t available in portions of the us, let alone globally.
“in terms of cloud gaming, we're still in the active experimentation phase,” mckeon-white said. “and while the current results are much better than they were previously, it's still ... not the best possible experience for playing video games, if we’re completely honest.”
it’s also important to note that cloud gaming is still a small portion of overall gaming revenue. but, eventually, the service could power game pass subscriptions.
“i think it is a positive for cloudstream gaming,” ward said. “i think that it will be one of the drivers of growth over time, but let's not kid ourselves. right now, it's only like 2% or 3% of market revenue. it's a very small component of total market revenue.”
but as microsoft perfects the technology and high-speed internet continues to spread across the globe, xbox cloud gaming will become a far more attractive and viable option for gamers in regions where consoles and pcs are too expensive due to taxes or import restrictions.
there’s one other aspect to microsoft’s acquisition that could prove beneficial over time, and that’s how the company could take advantage of older activision blizzard properties. there are a slew of titles, such as “guitar hero,” that the gaming giant hasn’t worked on in years, and with microsoft’s backing, it could begin to dig those out of storage and breathe new life into them.
what’s more, it gives microsoft a boost to the number of first-party games it will release each year.
“there's just a critical mass that they probably weren't at prior to the acquisition, and this pushes them over the top,” wedbush analyst michael pachter told yahoo finance. “you suddenly go from maybe a half a game a year of new content under the old microsoft to four, five, plus ‘world of warcraft.’ ”
taken as a whole, the acquisition is a boon for microsoft. though it could take some time for it to begin to pay dividends. after all, with games already in development it will be a while before microsoft has any real say in how activision blizzard develops new titles.
there’s also the looming threat that the federal trade commission (ftc) could break up the companies as part of its antitrust case against microsoft. the ftc is moving forward with an in-house challenge to the deal and working on an appeal to a prior ruling against the commission’s effort to halt the move.
still, if everything pans out in microsoft’s favor, acquiring activision blizzard could be a turning point for the company, and the gaming industry as a whole.
daniel howley is the tech editor at yahoo finance. he's been covering the tech industry since 2011. you can follow him on twitter @danielhowley.
click here for the latest technology business news, reviews, and useful articles on tech and gadgets
read the latest financial and business news from yahoo finance"
the housing winter arrives early as existing-home sales crash to great recession levels and the long-feared ‘deep freeze’ sets in,2023-10-20T20:30:29.000Z,Sydney Lake,"after a long, hot summer that saw mortgage rates creep ever higher, october has brought an early winter for the housing market. existing-home sales dropped a stunning 15% in september on a year-over-year basis to a seasonally adjusted annual rate of 3.96 million transactions, according to the national association of realtors (nar). that’s the lowest figure in 13 years, since 2010, when the world economy, and particularly the u.s. housing market, were struggling to pull out of the great financial crisis.
contributing factors to the continuous decline in home transactions include surging mortgage rates (which just hit 8% this week—a record in the 21st century), low inventory levels, and home prices that refuse to stop rising. in other words, there aren’t enough homes to buy, money isn’t cheap anymore, and the ones for sale are too rich for most homebuyers’ blood.
indeed, existing-home sales prices topped $306,000, a 5% increase since the year began, according to the case-shiller u.s. national home price index.
“as has been the case throughout this year, limited inventory and low housing affordability continue to hamper home sales,” nar chief economist lawrence yun said in a statement. “the federal reserve simply cannot keep raising interest rates in light of softening inflation and weakening job gains.” the fed has raised rates several times this year, with chair jerome powell arming his “higher for longer” stance.
declining housing inventory levels also contribute to the drop in housing transactions. housing inventory is down 8.1% from this time last year, according to nar. some real-estate experts and economists argue that housing affordability is even worse now than during 2008, when a damaging downturn in the u.s. housing market set off the dominoes that became the great financial crisis that defined a whole decade economically—and in some ways, our current predicament.
in 2010, the last time existing home sales were so low, the global economy was on life support and the fed slashed interest rates down to zero to revive the flatlining patient—fueling an “everything bubble” that inflated all kinds of assets along the way, not the least, housing. the zero-rate regime persisted until the highest inflation in 40 years surprised many economists and prompted the massive series of rate hikes that have brought us to the once-unthinkable 8% mortgage.
some onlookers saw what was coming, for instance zillow, which warned in may that housing would enter a “deep freeze” if the debt limit standoff failed to resolve and america defaulted, as that would send mortgage rates up to 8%. of course, the default was averted, but here we have arrived at 8% mortgage rates anyway. but this isn’t like 2008 or 2010 again. it’s time for a 1980s history lesson.
the housing market today isn’t identical to that of the ‘80s, but it’s pretty close. in a lot of ways, millennials are being forced to follow the housing journey of their boomer parents as they face a frozen, unaffordable market with rising interest rates, as noted recently by both bofa research economist jeseo park and by first american chief economist mark fleming.
essentially, millennials are a giant generation all collectively coming of homebuying age nearly simultaneously—just like their boomer parents in the 1980s. they’re the “biggest share of the “homebuying pie,” as redfin puts it, purchasing about 60% of homes bought with mortgages during the past few years.
plus, the raising of interest rates in an effort to combat inflation is strikingly similar to the ’80s. back then, fed chair paul volcker fought inflation through aggressive interest rate hikes, with the average 30-year fixed mortgage peaking at about 18% by late 1981. sound familiar? current fed chair jerome powell has set the tone for the most aggressive global hiking of rates in the modern era. and in due course, this week, mortgage rates hit 8%, the highest they’ve been in more than 20 years.
all things considered, home sales activity also plummeted from 1978 to 1982. existing-home sales dropped 50% during that period, according to the office of policy development and research. and while we haven’t seen home sales activity levels this low since the 2000s, the housing market more closely mimics that of the ’80s, according to a report published this week by fortune 500 financial services company first american.
“today’s housing market isn’t anything like the housing market of the mid-2000s,” first american’s fleming wrote in a tuesday report titled “1980s déjà vu for the housing market.” “the housing market today is not overbuilt, nor is it driven by loose lending standards, subprime mortgages, or homeowners who are highly leveraged.”
while some economic factors are stronger today than they were during the gfc, housing affordability is undeniably worse.
“while housing and more generally consumer fundamentals are in a much stronger position today, affordability for the incremental buyer is worse than it was at the peak in 2006 before the crash,” roger ashworth, a managing director at goldman sachs, wrote in a credit strategy research paper released last week.
and he’s not hopeful we’ll see home prices drop anytime soon: “absent any negative shocks to the broader economy that would either boost excess supply of homes on the market or fuel an uptick in unemployment, we continue to expect home prices to rise at a slow pace.” in fact, he predicts we’ll see home prices rise by 1.8% by the end of the year, with a 3.5% increase by the end of 2024.
looking at more recent housing inventory data makes the issue even more stark. between september 2018 and september 2023, the average number of homes on the market dropped a whopping 60% to fewer than 700,000 active listings, according to realtor.com.
“unlike the turn of the millennium, house prices today are rising alongside mortgage rates, primarily due to low inventory,” sam khater, freddie mac’s chief economist, said in a statement released sept. 29. “these headwinds are causing both buyers and sellers to hold out for better circumstances.”
but with the development that home sales transactions are at their lowest level in the past 13 years coupled with century-high mortgage rates of 8%, many real estate experts and economists aren’t hopeful that affordability constraints will let up soon.
out of fear of losing their lower interest rates, current homeowners are resistant to putting their homes on the market, ultimately leading to the abysmal inventory levels—leaving fewer and fewer properties exchanging hands. indeed, more than 90% of existing-home owners are locked into mortgage rates below 6%, odeta kushi, deputy chief economist at first american, previously told fortune.
“these homeowners do not have a financial incentive to sell,” kushi says. “the combination of reduced affordability and an even stronger rate lock-in effect suppresses home sales because you can’t buy what’s not for sale, even if you can afford it.”
this story was originally featured on fortune.com"
calls to empower patrick mchenry get louder as republicans again fail to pick a speaker,2023-10-18T17:37:20.000Z,Ben Werschkul,"rep. jim jordan (r-ohio) fell short for a second time in his quest for the speaker’s gavel wednesday, with more of his gop colleagues voting against him today than yesterday. the resilient opposition to his hardline candidacy is fueling new calls for a stopgap maneuver to get the house operational again.
the idea that has been put forth by both democrats and republicans in recent days would empower rep. patrick mchenry (r-n.c.) with new powers. he currently oversees the chamber as speaker pro tempore but operates with restricted powers.
for now, mchenry only has the authority to convene a vote for the next full speaker but growing his powers could at least temporarily allay some fears on wall street and in the business world about the seemingly endless dysfunction on capitol hill.
mchenry was a key architect of this spring’s debt-ceiling deal that averted a financial catastrophe and he would be faced with similar challenges in the weeks ahead, with government spending fights looming between now and the end of the year between house republicans and the senate and the white house.
depending on the scope of his power, mchenry could also theoretically push forward business world priorities, notably two ongoing cryptocurrency efforts — one bill focused on crypto’s market structure and another focused on stablecoins — that he has championed as chair of the house financial services committee.
while mchenry himself has repeatedly batted down the idea, a growing number of prominent conservative figures and organizations have warmed up to it.
three former gop house speakers — newt gingrich, john boehner, and paul ryan — have openly highlighted the idea.
in comments at harvard on tuesday, ryan called it a ""break the glass, last resort"" option but quickly added ""that’s probably where they're going to end up if jim jordan can’t put it together.""
the idea has also been espoused in various influential conservative forums like the wall street journal editorial page as well as by jordan opponents like reps. mario díaz-balart (r.-fla.) and mike kelly (r-penn.).
i am requesting that the house immediately come back for a second vote on the speaker @patrickmchenry pic.twitter.com/3eh1jw9tqj
— mario diaz-balart (@mariodb) october 17, 2023
the surge in gop support for the idea comes after the idea has been touted by democrats over the last week.
""we strongly support an immediate vote to expand the speaker pro tempore's authorities to allow for the consideration of a legislative agenda limited to the most pressing issues,"" wrote four moderate democratic lawmakers in a letter last week.
house minority leader hakeem jeffries added tuesday that there are ""ongoing informal conversations"" around bipartisan compromises.
of course the idea of empowering mchenry faces significant challenges ahead, notably from jordan and his allies who appear poised to keep fighting even after losing two rounds of voting.
any measure to empower mchenry would almost surely require both democrats' and republicans' votes and could gain the intense ire of some on the far right. for example, rep. matt gaetz (r-fla.) has already been criticizing mchenry for how he’s exercised his limited powers.
the extent and duration of mchenry’s possible powers could also be a point of contention if the idea advances further.
the various comments in support of the idea differ on significant details, such as whether mchenry should be empowered until a certain date or indefinitely.
also up for debate is whether he would be able to address any issue that arises or focus only on certain circumscribed ideas like a government shutdown and foreign aid. there is also an open question about whether an empowered speaker pro tempore would be in the presidential line of succession.
finally, mchenry himself is also a wild card. he has repeatedly downplayed the idea in comments to reporters on capitol hill.
mchenry is also a close ally of kevin mccarthy, who selected him for his current position atop the house, but has avoided calls to join the house leadership on a permanent basis for years, preferring instead to serve as chair of the financial services committee.
ben werschkul is washington correspondent for yahoo finance.
click here for politics news related to business and money
read the latest financial and business news from yahoo finance"
biden doesn't just want aid for ukraine and israel. he also wants billions to confront china.,2023-10-20T16:31:30.000Z,Ben Werschkul,"president biden doesn’t just want new money to assist with wars in ukraine and israel. he also wants billions to confront china.
following an address to the nation, where he exhorted americans to support his efforts in ukraine and israel, president biden announced the complete details of his administration's request to congress on friday.
within the nearly $106 billion supplemental funding request to congress is an ask for $7.4 billion toward china-focused efforts by his administration.
the money would be divided between $3.4 billion for america’s submarines that operate in the region, $2 billion for new financing efforts to counter china’s economic might, and another $2 billion for state department foreign military efforts.
if approved, the money could flow toward taiwan and other us allies in the region and potentially re-inflame us-china tensions after a year of tense back and forth between the two superpowers.
this money is crucial, national security advisor jake sullivan told reporters friday, as part of ""efforts to maintain peace and stability"" in the indo-pacific region adding that the new funds would represent ""significant new resources to help [us allies] build the capabilities necessary to meet emerging challenges.""
of course, the administration’s funding request will have to navigate the dysfunction on capitol hill first, as lawmakers in the house of representatives still remain deadlocked on a replacement for the ousted kevin mccarthy after more than two weeks.
""the world is watching and the american people rightly expect their leaders to come together and deliver on these priorities,"" wrote office of management and budget director shalanda young in a letter to congress on the package — which also includes more than $60 billion for ukraine, more than $20 billion for the middle east, and more than $10 billion for america’s southern border.
due to the ongoing chaos on capitol hill, her letter had to be addressed to rep. patrick mchenry (r-n.c.), the speaker pro tempore of the house of representatives. mchenry has adamantly maintained he has no power to consider the request until house republicans agree on a plan for going forward.
if approved, much of the money would be directed toward the us navy’s public shipyards to build up the us's capacity to stand up to china militarily.
the money would accelerate the building of attack submarines to patrol in the indo-pacific and help fulfill an ongoing security partnership between australia, the united kingdom, and the us, biden officials said.
the biden administration is also asking for $2 billion to ""provide a credible alternative to the people’s republic of china’s coercive and unsustainable financing for developing countries around the world,"" according to a fact sheet.
the administration says the money could be leveraged to unlock up to $21 billion in new lending opportunities through the international monetary fund and world bank.
a third tranche of the money would allot $2 billion toward general military readiness efforts in the region.
the biden administration didn’t outline precisely how much of the funds would go to taiwan, with the political status of the island a long-running source of tension. sullivan underlined friday that the funds would be spread across the entire region and not be exclusive to taiwan.
biden himself also noted in his address to the nation that his larger national security effort has at least one eye on china, especially the $61.4 billion he wants to use for ukraine's war.
""if we walk away and let putin erase ukraine’s independence, would-be aggressors around the world would be emboldened to try the same,"" he said from the oval office, saying the chaos could spread both to the indo-pacific as well as to the middle east.
ben werschkul is a washington correspondent for yahoo finance.
click here for politics news related to business and money
read the latest financial and business news from yahoo finance"
