Title,Time,Author,Content
two long-shot options to restart the house if jim jordan isn’t elected speaker,2023-10-17T18:49:05.000Z,Ben Werschkul,"republicans fell short yet again in their effort to agree on a next speaker of the house as rep. jim jordan (r-ohio) didn't have the votes on his first ballot before the full house of representatives.
twenty republican lawmakers voted against their colleague for the gavel, higher than many jordan allies had expected, dooming his bid at least on tuesday afternoon's first ballot.
jordan is set to push for more votes, telling reporters on the way into the chamber ""whatever it takes to get a speaker today."" but he could face a difficult challenge in the hours and days ahead in changing the minds of his opponents while also holding his own fragile coalition together.
in his own quest for job earlier this year, kevin mccarthy saw 19 republicans vote against him on the first ballot before he eventually prevailed following 15 grueling rounds of voting.
the latest round of gop dysfunction is sure to renew the focus on various long-shot options that have been circulating for days as ways to eventually restart the paralyzed lower chamber and address pressing issues such as aid for israel and a government shutdown deadline in just one month's time.
in a floor speech just before voting commenced, rep. pete aguilar (d-calif.) alluded to one of the options. he said if republicans can’t come together ""there is still a path forward"" for the parties to band together for a bipartisan vote on at least some issues like keeping the government open.
""it’s that simple, mr. speaker,"" he added, ""we can do it today.”
a second idea in the mix would be to expand the limited powers that the current overseer of the house enjoys.
here is a closer look at two options that could be on the table in the days ahead if the gop dysfunction continues:
one option increasingly being bandied about is a consensus speaker that could be elected with both republican and democratic votes.
house minority leader hakeem jeffries has repeatedly called for this option and reiterated the possibility over the weekend, telling nbc sunday that ""informal"" conversations are underway.
""we are ready, willing, and able to enter into a bipartisan governing coalition,"" jeffries said, adding a hope that the talks will get more concrete this week while also saying the democrat price for such a compromise would be less republican control over what reaches the floor for a vote.
the effort faces opposition from conservative republicans and there is not a clear consensus candidate, but democrats hope talks could heat up in the days ahead.
for his part, jordan has tried to head off the bipartisan idea all week. he said in a post on x sunday that ""differences between republicans and democrats in the house far outweigh our differences in the republican conference.""
after tuesday’s failed vote, jordan began meeting directly with the holdouts apparently both to try and change their minds but also stop any interest in a bipartisan solution.
another possibility would be the for current overseer of the house, rep. patrick mchenry (r. n.c.), to assume expanded powers and then use them to address issues like a government shutdown or aid to israel.
according to the rules, mchenry currently only has the power to convene a vote for the next speaker but some lawmakers say he could quickly be given the authority to convene votes on legislation.
""we strongly support an immediate vote to expand the speaker pro tempore's authorities to allow for the consideration of a legislative agenda limited to the most pressing issues,"" wrote four moderate democratic lawmakers in a recent letter even as mchenry himself has often repeatedly batted away the suggestion.
indeed, empowering mchenry appears to be more popular with democrats than with republicans at the moment. some on the far right — notably rep. matt gaetz (r-fla.) — have been criticizing mchenry for even how he’s exercised his limited powers. but the maneuver could see increasing moderate support if the stalemate continues.
""my opinion is that the longer this drags on, the more authority the speaker pro tempore will be authorized,"" says henrietta treyz, veda partners managing partner and director of economic policy research, in a recent interview.
it's ""maybe the path of least resistance at this point,"" she added.
ben werschkul is washington correspondent for yahoo finance.
click here for politics news related to business and money
read the latest financial and business news from yahoo finance"
big banks are benefiting from higher rates. their customers aren't.,2023-10-15T11:47:10.000Z,David Hollerith,"higher interest rates are lifting the fortunes of the nation’s biggest banks. they aren’t doing the same for the banks’ customers.
earnings for jpmorgan chase (jpm), citigroup (c), and wells fargo (wfc) all rose in the third quarter largely because high rates allowed them to rake in more interest income.
their scale allows them to leverage those rates by charging more for loans while holding down how much more they pay for deposits when compared to smaller rivals.
these advantages show up in a key profitability metric known as net interest income, which measures the difference between what banks make on their loans and pay for their deposits.
that number was up by sizable amounts at all three banks when compared to the same period a year ago. together the lenders pulled in a record $50 billion, 18% more than the same period last year. jpmorgan and wells fargo even lifted their guidance for how much net interest income they would earn for the full year.
yet there were also clear signs that some of their borrowers are starting to struggle. jpmorgan, citigroup, and wells fargo all increased the amount of loans they wrote off as losses. the combined charge-offs at those three banks totaled $3.98 billion, up 31% from the previous quarter and 105% from the same period a year ago.
the total was the highest amount collectively for the three lenders since the early days of the pandemic, in the second quarter of 2020.
at citigroup, ceo jane fraser warned that us consumers were cutting back. “continued deceleration in spending indicates an increasingly cautious consumer,” she said in a release.
affluent customers, she added, are accounting for almost all of the spending growth and weakness is showing among those with lower credit scores. citi expects its credit card losses to reach pre-covid levels by the end of the year.
wells fargo ceo charlie scharf said even as the economy remains resilient “we are seeing the impact of the slowing economy with loan balances declining and charge-offs continuing to deteriorate modestly.”
wells fargo had charge-offs of $850 million, $622 million from consumer loans. the bank expects its net interest income to fall 3% from the third quarter to the fourth.
""where wells fargo sees weaknesses,"" according to cfo mike santomassimo, is in commercial real estate, and ""i think we will see some loss pickup in that portfolio over time.""
jpmorgan ceo jamie dimon struck a more somber tone. he said consumers and businesses “generally remain healthy” but consumers are spending down their excess cash buffers at a time when inflation risks remain elevated, increasing the possibility that interest rates could go even higher.
wars in ukraine and israel, he added, could also impact energy, food markets, global trade, and geopolitical relationships.
""this may be the most dangerous time the world has seen in decades,"" he said.
he admitted that the bank has been “over-earning on both net interest income and below normal credit costs, both of which will normalize over time.” he told reporters there is a “big debate” within the bank about when that normalization will happen.
“i personally think it will happen a little sooner than jeremy,” he said, referring to his cfo.
dimon, s&p global market intelligence director for financial institutions research nathan stovall told yahoo finance on friday, was “trying to throw out some caution.”
the bank, he added, knows credit costs are going to go up. “they are trying to prepare the street that you could see tougher times ahead.”
one regional bank, pnc (pnc), demonstrated the problems that smaller lenders have navigating this period of higher rates. its profits and revenue fell from a year ago, as did its net interest income. it expects net interest income to fall again in the fourth quarter when compared to the third.
the pittsburgh bank said it would reduce its staff by roughly 4%, saving $325 million. several other regional banks, including truist (tfc), have also eliminated jobs in recent months as they adjust to more uncertain economic conditions.
pnc’s stock fell 3% friday while citigroup's stock sold off slightly in the later part of the day. jpmorgan and wells fargo both rose.
""the inflection point,"" pnc ceo william demchak said in response to a question about whether pnc's net interest income had reached a trough, ""i think is entirely dependent on what happens with the fed in the coming year.""
click here for in-depth analysis of the latest stock market news and events moving stock prices.
read the latest financial and business news from yahoo finance"
jay powell will keep saying inflation is too high until consumers believe him,2023-10-20T10:00:20.000Z,Hamza Shaban,"this is the takeaway from today's morning brief, which you can sign up to receive in your inbox every morning along with:
the chart of the day
what we're watching
what we're reading
economic data releases and earnings
there’s a reason fed chair powell keeps saying inflation is too high, and it’s not just because the numbers say so.
banging a hammer of repetition is an attempt to set expectations. and where inflation is concerned, what americans think will happen has a way of becoming what happens, just as the fed’s threats of more rate hikes are meant to foreshadow a future course of monetary policy.
""doing too little could allow above-target inflation to become entrenched and ultimately require monetary policy to wring more persistent inflation from the economy at a high cost to employment,"" powell said in a speech thursday before the economic club of new york.
fed officials, in their own washington dialect of hyper-guarded and abstract language, tell the public what they will do to achieve their inflation goal. that’s meant to build a sense of trust and shape expectations: if the rate of inflation rises or holds stubbornly high, the public can expect tightening from the fed.
read more: what the fed rate-hike pause means for bank accounts, cds, loans, and credit cards
the central bank’s inflation target of 2% in part defines what people think inflation will be, which in turn becomes the actual rate of inflation. but a theoretical self-fulfilling prophecy has its real-world hiccups.
consumers are growing increasingly worried about inflation’s sting — and don't believe powell will make it go down.
the first october reading of the university of michigan consumer sentiment index showed americans expect prices to rise 3.8% over the next year, the highest level in five months. and the pessimism has grown slightly over the long run too, with consumers expecting costs to rise 3% over the next five to 10 years, up from a prior reading of 2.8%. compared to the two years before the pandemic, these long-run inflation expectations remain elevated.
powell acknowledged these risks of persistent price pressures in his thursday speech.
in 2020, the federal reserve altered its approach of adhering to a hard 2% inflation target and adopted a new goal that averages 2% inflation over time. even with that added flexibility, the fed has drawn criticisms that its inflation goal is no longer suited for the times.
altering the target would puncture the fed’s credibility, proponents of the 2% benchmark say, and would undermine the self-reinforcing dynamic of setting price expectations and seeing them play out in the world.
the fed’s forward guidance and its use of public communications to steer policy can look and sound a lot like wishful thinking. in some ways it is. but it does have real impacts. the threat of a hike can almost function like another phantom rate hike. part of getting that desired outcome is repeating again and again that it will happen until it does.
this messaging campaign isn't new. in a 2022 address, former fed chair ben bernanke said that the role inflation expectations play in monetary policy rests on two key premises: that expectations are an important element of actual inflation and that the actions and remarks of central bankers can further influence what people think and economic outcomes.
but powell and co. need to sell it since the inflation people experience depends partly on what people expect it to be. and as temporary, elevated rates of inflation harden in the minds of consumers, that can shift their expectations further, in effect cementing a more pessimistic vision of price increases into reality.
hamza shaban is a reporter for yahoo finance covering markets and the economy. follow hamza on twitter @hshaban.
click here for the latest economic news and indicators to help inform your investing decisions.
read the latest financial and business news from yahoo finance"
"stocks slip, oil jumps as hospital blast fans mideast fears: stock market news today",2023-10-18T13:40:55.000Z,Karen Friar,"stocks opened lower wednesday, as a tightening in middle east tensions was reflected in a jump in oil prices and investors digested lackluster earnings from morgan stanley.
the dow jones industrial average (^dji) fell more than 0.2% while the benchmark s&p 500 (^gspc) dropped nearly 0.5% and the tech-heavy nasdaq composite (^ixic) slipped 0.3%.
caution prevailed in markets as israeli and palestinian authorities traded blame for an explosion at a hospital in gaza.
president joe biden landed in israel on wednesday, but jordan canceled a planned summit with arab leaders after the gaza blast. biden's comment that the ""other team"" was responsible dimmed hopes for a diplomatic solution and highlighted the risk of a full-blown regional conflict.
oil prices moved up more than 1%, with gains stacking up after iran's foreign minister called for an embargo against israel. crude oil (cl=f) futures climbed to $88 a barrel, while brent crude (bz=f) traded at $91 a barrel at the last check.
rising fuel prices give investors another inflation factor to consider as they weigh the federal reserve's next move in interest rates. the major us stock indexes closed mostly flat on tuesday after strong retail sales spurred expectations that the fed will hike again this year.
read more: what a fed rate-hike pause means for bank accounts, cds, loans, and credit cards
after the bell, tesla (tsla) and netflix (nflx) lead out tech earnings, which will be closely watched for any impact from ""higher for longer"" interest rates.
among techs, shares of asml (asml, asml.as) fell after the dutch chip equipment maker warned about flat sales ahead, as customers slow orders thanks to an uncertain economic backdrop.
meanwhile, nvidia (nvda) stock retreated alongside other semiconductor makers after the us tightened curbs on ai chip technology exports to china, though there could be a lifeline in the rules.
stocks were lower at the market open on wednesday as rising middle east tensions sent oil prices higher and investors digested lackluster earnings from morgan stanley. 
the dow jones industrial average (^dji) fell more than 0.2% while the benchmark s&p 500 (^gspc) dropped nearly 0.5% and the tech-heavy nasdaq composite (^ixic) slipped 0.3%.
here are some of the stocks leading yahoo finance’s trending tickers page in premarket trading on wednesday:
morgan stanley (ms): shares fell by over 2% on wednesday. third quarter profits dropped 9% from a year ago as revenue from investment banking and trading fell, as reported by yahoo finance’s david hollerith.
procter & gamble (pg): shares rose by 2% premarket. yahoo finance’s brian sozzi reported on p&g’s successful push with price increases as it continued to double down on new product innovations.
asml (asml): shares in asml were down by 3%. the semiconductor equipment maker announced lower-than-expected orders on wednesday.
nvidia (nvda): shares dropped by over 1% after a more than 4% decline on tuesday, after the us said it would tighten curbs on chip exports to china. however, the biden administration's new rules appeared to throw nvidia, along with intel (intc) and amd (amd), a lifeline in the hope it would help preserve the us chipmaking business. it was also reported on wednesday that foxconn will build a new kind of data center using nvidia chips and software.
major us stock gauges were poised for a muted open wednesday amid growing tensions in the middle east, as investors waited for netflix and tesla to kick off tech earnings.
futures on the dow jones industrial average (^dji) were down 0.34%, or 117 points, while s&p 500 (^gspc) futures dropped 0.49%. contracts on the tech-heavy nasdaq 100 (^ndx) fell 0.64%.
click here for the latest stock market news and in-depth analysis, including events that move stocks
read the latest financial and business news from yahoo finance"
