Title,Time,Author,Content
wall street's 'magnificent seven' face moment of truth as earnings season arrives,2023-10-19T14:27:05.000Z,Lewis Krauskopf,"by lewis krauskopf
new york (reuters) - high noon is approaching for the market's biggest stocks, as pressure grows on richly valued technology and growth companies to deliver robust earnings at a time when sky-high bond yields threaten to dull the allure of equities.
huge rallies for the so-called ""magnificent seven"" stocks – apple, microsoft, alphabet, amazon, nvidia, tesla and meta platforms – have driven nearly all of the s&p 500’s 12% year-to-gain because of their outsized weighting in the index.
that stellar performance has also raised the stakes in the upcoming earnings season. valuations have swelled, with the magnificent seven trading at an average forward price-to-earnings ratio of 33.5, compared with the s&p 500's p/e of 18.3.
at the same time, treasury yields at 16-year highs are providing investment competition to stocks. with u.s. government bonds now offering risk-free yields of around 5% or more, investors may be less forgiving of companies which are unable to deliver strong results.
that appeared to be the case for tesla, the first of the megacaps to report results this period. shares of tesla were down 7% on thursday morning after the electric vehicle maker missed wall street estimates on third-quarter gross margin, profit and revenue.
“everybody knows these guys are going to make money,"" said sameer samana, senior global market strategist at the wells fargo investment institute (wfii), referring to the magnificent seven. ""the only question is how fast is that earnings growth, and have investors overpaid for it.""
the wells fargo investment institute in june downgraded its rating on the information technology sector — which includes apple, microsoft and nvidia — to ""neutral"" from ""favorable.”
results from microsoft, google-parent alphabet, amazon and facebook-parent meta are expected next week, while apple and nvidia are set to report next month.
in aggregate, the megacap companies are expected to post a 32.8% gain in earnings in 2023, while the rest of the s&p 500 sees a 2.3% decline, according to tajinder dhillon, senior research analyst at lseg.
complicating the outlook is the relentless climb in interest rates and treasury yields, which has been driven by a mix of federal reserve hawkishness in the face of a strong economy and worries over the u.s. fiscal picture.
growth and tech companies are seen as being more vulnerable to higher yields, as their typically robust projected future cash flows are valued less highly when investors can earn more from risk-free government bonds.
the yield on the benchmark 10-year treasury recently stood at 4.94%, its highest since july 2007.
“people have got choices that they didn’t have and they will allocate differently,"" said tim pagliara, chairman and chief investment officer at capwealth. ""the reallocation of funds going forward is going to suggest lower returns and more difficulty for the magnificent seven to maintain their leadership.""
capwealth holds microsoft shares and below-benchmark positions in apple and amazon, pagliara said.
tesla ceo elon musk said on wednesday that he was concerned about the impact of high interest rates on car buyers.
the megacaps' outperformance this year means their market heft has also grown. the seven companies' combined market capitalization topped 30% of the s&p 500's overall market value earlier this month, according to lseg datastream.
more than a third of fund managers named ""long big tech"" as the most crowded trade, according to bofa global research's monthly survey published this week.
""returns this year in the s&p 500 have been driven entirely by returns in the seven biggest stocks, and these seven stocks have become more and more overvalued,"" torsten slok, chief economist at apollo global management, said in a note.
of course, betting against the market’s champions has proven an unprofitable endeavor. the 10-stock nyse fang+ index, which includes the magnificent seven, has gained 140% since the end of 2019 before the pandemic, versus a 33% gain for the s&p 500.
some investors are also drawing distinctions among the seven stocks. brandywine global holds shares of alphabet and meta, which generate significant cash and are cheaper than megacap peers, said patrick kaser, a portfolio manager at the investment firm.
""they are all growth stories,"" kaser said. ""but where that growth comes from, how steady it is supposed to be, and how much is in their control, really differs a lot among the seven.""
(reporting by lewis krauskopf; editing by ira iosebashvili and jonathan oatis)"
"us budget gap soars to $1.7 trillion, largest outside covid era",2023-10-20T20:03:47.000Z,David Lawder,"by david lawder
washington (reuters) -the u.s. government on friday posted a $1.695 trillion budget deficit in fiscal 2023, a 23% jump from the prior year as revenues fell and outlays for social security, medicare and record-high interest costs on the federal debt rose.
the treasury department said the deficit was the largest since a covid-fueled $2.78 trillion gap in 2021. it marks a major return to ballooning deficits after back-to-back declines during president joe biden's first two years in office.
the deficit comes as biden is asking congress for $100 billion in new foreign aid and security spending, including $60 billion for ukraine and $14 billion for israel, along with funding for u.s. border security and the indo-pacific region.
the big deficit, which exceeded all pre-covid deficits, including those brought about by republican tax cuts passed under donald trump and from the financial crisis years, is likely to enflame biden's fiscal battles with republicans in the house of representatives, whose demands for spending cuts pushed the u.s. to the brink of default in early june over the debt ceiling.
a deal to avoid a government shutdown over deeper spending cut demands from republican hardliners led to the ouster of u.s. house of representatives speaker kevin mccarthy, and the party is still divided over who should lead them, which is expected to make negotiations ahead of a new fiscal deadline in mid-november more difficult.
for september, the final month of the fiscal year, the deficit fell to $171 billion from $430 billion in september 2022.
""falling revenues are a significant contributor to the 2023 deficit, underscoring the importance of president biden's enacted and proposed policies to reform the tax system,"" treasury secretary janet yellen and office of management and budget director shalanda young said in a joint statement.
the fiscal 2023 deficit would have been $321 billion larger, but was reduced by this amount because the supreme court struck down biden's student loan forgiveness program as unconstitutional. the ruling forced the treasury to reverse a pre-emptive charge against fiscal 2022 budget results that increased that year's deficit.
the fiscal year 2022 deficit was $1.375 trillion.
taking into account the two one-off adjustments, last fiscal year's deficit would have been closer to $1 trillion and this year's closer to $2 trillion, a treasury official said.
record interest costs
the 2023 deficit marks an abrupt end to two years of falling deficits for biden as covid-19 spending faded. the u.s. deficit peaked in fiscal 2020 at $3.13 trillion as the sharpest downturn since the 1930s severely constrained tax revenues while spending on unemployment benefits, direct payments to consumers and aid to businesses peaked.
but the congressional budget office has warned that based on current tax and spending legislation, u.s. deficits will approach covid-era levels by the end of the decade, reaching some $2.13 trillion in 2030 as interest, health and pension costs mount.
for the 2023 fiscal year, total revenues fell $457 billion, or 9% from fiscal 2022, to $4.439 trillion, largely due to a drop in non-withheld individual income tax payments amid a worse performance in stocks and other financial assets as interest rates rose.
other revenue declines included a $106 billion drop in federal reserve earnings as interest paid on bank reserves ate up any portfolio income.
fiscal 2023 outlays fell $137 billion, or 2% from the prior year to $6.134 trillion. outlays would have been more modest were it not for large increases in spending on retirement and healthcare benefits for the elderly and in debt service costs.
social security spending rose 10% to $1.416 trillion due to cost of living adjustments for inflation, and spending for the medicare senior healthcare program rose 4% to $1.022 trillion.
interest costs on the more than $33 trillion in federal debt also rose sharply, up 23% to $879 billion, a record. net interest payments, excluding intragovernmental transfers to trust funds, rose 39% to $659 billion, also a record, according to a treasury official.
gross interest payments amounted to 3.28% as a share of gross domestic product, the highest since 2001, and the net share at 2.45% was the highest since 1998, the official said.
interest rates have soared over the last year and a half as the federal reserve jacked up borrowing costs to slow inflation. the average interest cost on the treasury's outstanding debt was 2.97% last fiscal year, up from 2.07% the year before.
(reporting by david lawder and dan burns; editing by andrea ricci)"
"fed has 'wrong inflation target,' should be less data dependent, el-erian says",2023-10-19T15:24:02.000Z,Hamza Shaban,"the dependence on economic data that has been a guiding light of jerome powell's tenure at the federal reserve is also one of its great weaknesses, said mohamed el-erian in a new interview with yahoo finance's julie hyman on thursday.
in critical remarks of the us central bank, the president of queens' college, cambridge, and chief economic adviser at allianz, said that powell's emphasis on backward-looking data, which operates with a lag, has denied the economy and market observers the clarity and vision that were present under previous eras of the fed.
el-erian pointed to the sharp rise in treasury yields as a cause for concern.
in addition to the higher borrowing costs for both households and businesses and the drag on the economy, he emphasized the abrupt climb of yields. ""there's fear, and i hope it's just a fear, that this could break something.""
treasury yields have continued their march higher, with the 10-year treasury reaching 4.9% for the first time since 2007 in a move that has dragged the stock market lower. as investors sell bonds, prices fall and yields rise. and as this year's sell-off in the bond market deepens, yahoo finance's jared blikre reports, there's increasing worry that an approach towards a big, round number like 5% for 10-year yields can serve as a psychological magnet for investors, lifting yields even higher.
for el-erian, fed policy is no longer an anchor. ""it's too backward-looking,"" he said. ""so this is really a hard time for the bond market. and we need stability. we desperately need stability.""
powell said thursday that the fed would proceed ""carefully"" with its next steps. el-erian said he'd like the fed chair to pull back from an approach that is ""excessively data-dependent."" instead, he'd like powell to recognize that ""you cannot drive a car on a curvy road looking through the back-view mirror,"" he said.
el-erian continued: ""that's what data dependency does. when your fed tools operate with lags, it becomes a problem at points of inflections.""
contrasting powell's leadership style with former fed chairs janet yellen (now the current treasury decretary), ben bernanke, and alan greenspan, el-erian said ""this is the first fed that hasn't got a single strategic bone in it.""
the fed's inflation goal of 2%, which has proven to be an elusive figure for central bankers, also drew el-erian's criticism. ""we have the wrong inflation target,"" he said.
""even if you abstract from all the problems, the deep hole that the fed dug itself into, we have these genuine uncertainties about monetary policy going forward.""
hamza shaban is a reporter for yahoo finance covering markets and the economy. follow hamza on twitter @hshaban.
click here for the latest economic news and indicators to help inform your investing decisions.
read the latest financial and business news from yahoo finance"
only 2 major automakers haven’t adopted tesla’s ev charging standard,2023-10-20T20:42:12.000Z,Ben Munson,"tesla’s (tsla) north american charging standard (nacs) has steadily won over nearly every automaker and this week saw two more dominoes fall.
both toyota (including lexus) and bmw (including mini and rolls-royce) this week announced their plans to adopt nacs. toyota will incorporate nacs ports into certain toyota and lexus battery electric vehicles starting in 2025, and it will offer nacs adapters to customers with evs relying on the combined charging system (ccs). bmw announced almost identical plans.
with both toyota and bmw pledging to adopt nacs, that leaves stellantis and volkswagen as two of the only major automakers still holding out. general motors, ford, honda, nissan, hyundai, volvo, mercedes-benz, rivian, polestar, fisker and more have already announced plans to build evs that can tap into tesla’s massive global network of more than 50,000 superchargers.
most read on ien:
robots make slackers out of their human colleagues
rivian says georgia factory construction will proceed in 2024 
foxconn, nvidia to build factories for the 'ai industrial revolution'
podcast: kia's 'wake-up call'; old toilet factory closes; tesla's price cuts
in june, after the other two big u.s. automakers rolled out plans for nacs, stellantis told reuters it was still evaluating the standard.
""our focus is to provide the customer the best charging experience possible. our free2move charge brand will offer seamless, simple solutions whether at home or on-the-go through partnerships with charging providers,"" the company said in a statement.
in july, volkswagen also suggested it was open to shifting toward tesla’s charging standard after electric america, the charging network it owns, announced it will add nacs charging stations by 2025.
“we welcome access to additional charging infrastructure for our north american customers and always aim for improving the charging experience via open standards and seamless interoperability,” the company said in a statement.
with all the momentum behind nacs, it could only be a matter of time before stellantis and volkswagen jump on the bandwagon."
billionaire investor leon cooperman says the s&p 500 won't hit a new high for years – and house prices will probably fall,2023-10-20T22:22:04.000Z,Theron Mohamed,"leon cooperman told insider in an interview he thought stocks were overvalued.
the billionaire investor said he didn't expect the s&p 500 to hit a fresh high for a long time.
cooperman said a ""rolling correction"" was underway and house prices were likely to drop.
leon cooperman said stocks were overpriced, and the s&p 500 wouldn't notch a fresh high for a very long time.
""i made my money being a bull, but i find myself somewhat pessimistic at the present time,"" the billionaire investor and philanthropist told insider in an interview this week.
more than a decade of near-zero interest rates and gratuitous government spending have ""pulled forward demand in a dramatic way,"" driving up asset prices and running up the national debt, he said. ""ultimately, the piper has to be paid.""
but cooperman isn't quite as bearish as other market gurus such as jeremy grantham and john hussman.
""i don't think we're in a bubble; i think we're in a rolling correction,"" he said before adding that it would probably ""take a long time for us to work out the problems.""
cooperman predicted that the s&p 500 — which has returned at least 12% in five of the last seven years — would underperform for the next few years and not surpass its current record of about 4,800 points for a long while.
he said buying an index fund wouldn't be a winning strategy, and investing would be more of a stock picker's game.
the former boss of goldman sachs' asset management arm, who converted his omega advisors hedge fund into a family office in 2018, pointed out there had already been a bear market in the vast majority of stocks.
a handful of big tech names, including tesla, nvidia, and microsoft, have pulled the major indexes higher this year, but excluding the so-called magnificent seven, stocks are virtually flat.
cooperman also touched on the housing market, which saw prices jump by more than 5% to a record high in the first seven months of this year despite mortgage rates surging to multi-year highs.
home values have been shored up by a decadeslong shortfall in the number of new homes built each year. prospective sellers have also balked at listing their homes and taking on a new mortgage when 30-year rates are about 8%, compared with about 3% at the start of 2022.
the veteran investor said he expected home prices to fall due to the current affordability crisis. many buyers aren't willing or able to pay top dollar for their next home and take on a painfully high monthly mortgage payment.
cooperman, who recently published a memoir titled ""from the bronx to wall street: my fifty years in finance and philanthropy,"" has sounded the alarm on stocks a few times this year.
he said in february that the s&p 500 was likely to bottom around 3,100 points, or 35% below its january 2022 peak. and he said in june that nvidia stock surging by about 200% this year was ""not going to end well.""
read the original article on business insider"
stocks rise amid middle-east tensions: stock market news today,2023-10-16T13:33:31.000Z,Karen Friar,"stocks opened higher monday morning, as investors tracked us efforts to contain the israel-hamas conflict and got ready for a busy week of corporate earnings.
the dow jones industrial average (^dji) increased 0.6% or roughly 200 points, while the s&p 500 (^gspc) edged up by about 0.5%. the tech-heavy nasdaq composite (^ixic) gained 0.3%.
earnings season picks up steam this week, with reports from goldman sachs (gs) and bank of america (bac) due tuesday after upbeat results from their wall street peers. updates from tesla (tsla) and netflix (nflx) kick off tech earnings on wednesday, likely to be scrutinized for clues to the sector's resilience amid higher-for-longer interest rates.
read more: what a fed rate-hike pause means for bank accounts, cds, loans, and credit cards
alongside jpmorgan's results on friday, ceo jamie dimon said this may be ""the most dangerous time the world has seen in decades"", a warning that is still resonating days later.
investors remain focused on the middle east crisis — and right now, on whether the us and its allies can stop the clash from drawing in other countries, especially iran. a full-blown regional conflict could send oil prices surging well above $100 a barrel, risking a global recession, some analysts believe.
crude oil futures (cl=f) and brent crude futures (bz=f) traded in a tight range on monday around $88 and $91 a barrel respectively, after climbing almost 6% on friday.
but prices for gold and bonds fell, attracting those seeking safe havens. the 10-year treasury yield (^tnx) rose to 4.69%, recouping some of its losses from last week.
wall street pushed stocks upward on monday morning, as investors and tech companies braced for quarterly earnings scheduled for later this week, most notably tesla and netflix.
the s&p 500 (^gspc) edged up by about 0.5%, while the dow jones industrial average (^dji) increased 0.6% or roughly 200 points.the tech-heavy nasdaq composite (^ixic) gained 0.3%.
here are some of the stocks leading yahoo finance’s trending tickers page in premarket trading on monday:
rite aid corporation (rad): rite aid’s shares sunk more than 5% as the pharmacy chain filed for bankruptcy.
lululemon (lulu): shares of lululemon surged by over 5%. the athleisure wear maker is about to join the s&p 500 index.
pfizer inc. (pfe): pfizer's shares fell by over 1% on monday after the drugmaker slashed the sales forecast for its covid vaccine. the news dragged down other covid-heavy stocks, as moderna (mrna) and biontech (bntx), pfizer's covid vaccine partner, both fell by more than 4%.manchester united plc (manu): manchester united shares fell 9% amid concerns that a buyout by qatar's sheikh jassim bin hamad al thani could be off the table.
us stock futures were mixed, with tech stocks lagging, as investors watched for signs of escalation in the israel-hamas conflict with a busy week of earnings ahead.
futures on the dow jones industrial average (^dji) were up 0.40%, or 135 points, while s&p 500 (^gspc) futures rose 0.28%. contracts on the tech-heavy nasdaq 100 (^ndx) wavered around the flatline.
click here for the latest stock market news and in-depth analysis, including events that move stocks
read the latest financial and business news from yahoo finance"
