Title,Time,Author,Content
stocks haven’t been this volatile since the regional banking crisis,2023-10-20T15:45:07.000Z,Josh Schafer,"after months of calm trading, volatility has greeted investors over the past week as uncertainty about the fed's plans for interest rates and rising bond yields have weighed on equities.
on thursday, the cboe volatility index (^vix), wall street's favorite gauge for fear and volatility, hit 21 for the first time since a regional banking crisis rocked the stock market in march.
the move came as headwinds have been mounting for investors. geopolitical tensions are rising in the middle east. fears of recession are still proliferating through corporate america. there is uncertainty around leadership in washington and what that could mean for another government shutdown. bond yields are at 16-year highs, and oil prices have been resilient, too.
any one of these factors could weigh on markets. taken together, they've spooked what was once a roaring 2023 market rally.
""as investors navigate vix and bond yields, a defensive tilt is essential,"" evercore isi senior managing director julian emanuel wrote on thursday.
emanuel had drawn a key line in the sand for the vix at 21. below that number, the index could be ""micro-driven"" by things like ai and earnings results. above that level, and the macro factors could take control of the market.
""geopolitical risk (include ukraine/russia and china) is arguably as high as it has been at any time, except 9/11, since before the 1989 fall of the berlin wall,"" emanuel wrote.
but even with all the headwinds weighing on stocks, truist co-chief investment officer keith lerner points out the market story has been more about the rally pausing then a full-blown sell-off, with the s&p 500 down about 3.7% since the federal reserve solidified its higher for longer interest rate stance about a month ago.
""we're using the word crosscurrents right now,"" lerner told yahoo finance live. ""i do think as far as you think about what's happening, the, you know, equity market has been very resilient in spite of everything that's happened here recently.""
recent market action shows the path to a calmer vix is likely rather straightforward. investors want a clearer picture of when the fed will be done hiking rates, which would likely relieve pressure on yields. but unfortunately when that picture will be painted isn't nearly as straightforward.
""the main thing is, as we move towards the end of a fed funds hike cycle, we have to be a patient,"" oppenheimer managing director john stoltzfus, who has a 4900 year-end price target for the s&p 500, told yahoo finance live on friday.
josh schafer is a reporter for yahoo finance.
click here for the latest stock market news and in-depth analysis, including events that move stocks
read the latest financial and business news from yahoo finance"
even strong earnings might not be able to save stocks,2023-10-20T09:30:00.000Z,Josh Schafer,"companies are reporting earnings beats on both the top and bottom lines thus far in the third quarter. but it isn't helping the stock market.
all three of the major indexes closed lower on thursday. stocks took a noticeable shift downward after federal reserve chair jerome powell indicated the central bank was doubling down on the fed's ""higher for longer"" stance, sending bond yields to their highs of the day.
the move was emblematic of the market over the past several weeks, which has been almost entirely driven by the ""pain trade"" in bonds.
evercore isi senior managing director julian emanuel believed that earnings could be one of the catalysts for stocks to trade higher. but bond yields have pressed even higher, conflict in the middle east has intensified, and the republican party still hasn't decided on a speaker of the house.
""a tilt toward defensive strategies is becoming necessary,"" emanuel wrote in a new note to clients on thursday.
prior to earnings, emanuel had written that themes like artificial intelligence could benefit companies on the micro level. and, in some cases, individual beats have been rewarded handsomely (see netflix rising more than 16% thursday on its price hikes and subscriber beat). but overall, the cboe volatility index (^vix), wall street's favorite gauge for fear and volatility, is hovering near its highest levels in six months. and that has emanuel concerned.
in emanuel's view, the vix trading near 20 puts the index in a position to be ""micro-driven"" by things like ai and other investment themes. at 21, a level the index rose above on thursday, emanuel says market volatility becomes more driven by macro factors.
""geopolitical risk (include ukraine/russia and china) is arguably as high as it has been at any time, except 9/11, since before the 1989 fall of the berlin wall,"" emanuel wrote.
while earnings can drive individual stocks, the broader market story hasn't changed.
treasury yields remain volatile, while the unknowns around the us economy's trajectory, a boiling geopolitical feud in the middle east, and lack of direction in washington aren't going away. put together, the confluence of pressures isn't a good recipe for markets that typically hate uncertainty.
investors believe volatility in the bond market will end eventually, but a clearer picture of the fed's path forward must come first. throughout a more than 30-minute speech and discussion on thursday, powell didn't spell out if the fed would hike once more or not.
""there wasn't a clear message because he hedged his bets at every turn,"" kevin nicholson, riverfront global fixed income chief investment officer, told yahoo finance live on thursday.
and until that narrative changes, the market regime doesn't appear to be shifting either, even if earnings are beating expectations.
josh schafer is a reporter for yahoo finance.
click here for the latest stock market news and in-depth analysis, including events that move stocks
read the latest financial and business news from yahoo finance"
why you shouldn't listen to jamie dimon,2023-10-18T10:00:02.000Z,Julie Hyman,"this is the takeaway from today's morning brief, which you can sign up to receive in your inbox every morning along with:
the chart of the day
what we're watching
what we're reading
economic data releases and earnings
earlier in the week, jamie dimon got our attention by calling this perhaps “the most dangerous time the world has seen in decades.”
and that may be true, from a geopolitical perspective. wars are now raging in both ukraine and israel, with broader implications. dimon also pointed to the risks of the federal reserve’s quantitative tightening program at a time when inflation is persisting.
as my colleague brian sozzi wrote this week, when one of the most powerful ceos in the world makes a dramatic comment like that, you take notice.
but in markets, it’s always a good idea to think about how someone may be talking his book.
“for jamie dimon — for a bank that has strongly outperformed its peers, it’s a matter really of trying to lower expectations,” ken leon, a veteran bank analyst at cfra, told yahoo finance live. “that’s always his mission, to lower the bar, because it’s the one bank every quarter that outperforms and delivers across all the lines of business.” (jpm happens to be one of leon’s top picks).
and if you tune dimon out, there are quite a few reassuring signals.
take tuesday’s retail sales report, which came in double economists’ estimates. while it could put pressure on the fed to raise rates once again, central bank officials have presented a remarkably consistent message over the past couple of weeks: they are willing to be patient, and higher treasury yields are helping tighten financial conditions without them having to further raise rates at this time.
spurred by that retail sales data, the atlanta fed’s gdpnow forecast now stands at 5.4% annualized growth for the third quarter. the s&p 500 has bounced back by more than 3% since early october. early earnings from the big banks and the likes of johnson & johnson have beat estimates.
bank of america’s weekly fund flows data showed an 11th straight week of inflows into equities, with buyers favoring cyclicals over defensives — implying optimism about economic growth.
maybe investors should pay attention to what dimon said after his warning: “while we hope for the best, we prepare the firm for a broad range of outcomes so we can consistently deliver for clients no matter the environment.”
in other words, while there appear to be positive signs for the economy and markets, it never hurts to be prepared for anything.
click here for the latest economic news and indicators to help inform your investing decisions.
read the latest financial and business news from yahoo finance"
gas prices are falling even with oil nearing $90 a barrel — here's why,2023-10-17T19:35:39.000Z,Ines Ferré,"us crude oil futures have risen about 5% since the israel-hamas war started earlier this month, but that jump hasn't stopped the downward trend in gasoline prices.
the national average cost of retail gasoline sits at $3.58 per gallon, $0.10 less than a week ago, and $0.30 off from last month, according to aaa data. even california, which has the highest average in the nation at $5.59 per gallon, has seen a $0.17 decline from exactly one week ago.
""gas prices seasonally fall every autumn,"" andrew gross, spokesperson for aaa, told yahoo finance. ""2023 is no exception.""
the main reasons behind the fall decline is the switch to a less expensive winter blend driving fuel and lower seasonal demand.
""gas prices will likely keep dropping until the end of the year,"" gross said. ""the one caveat would be if the new war expands to include oil-producing nations in the region.""
inventories roughly 10% higher than this time one year ago are also pressuring gasoline prices.
the current decline is notable given prices at the pump are about $0.30 lower than a year ago, when oil was hovering around the same levels as today.
""this year is very different from last year, because refined products supply has increased,"" jeff barron, senior petroleum markets analyst at the us energy information administration, told yahoo finance. ""anything that adds product to the market is going to help bring down refinery margins.""
and consumers may continue to enjoy lower prices in the months ahead.
""if current crude prices continue to do the cha-cha, and there are no events (fires, hurricanes, etc.), consumers can expect another 20 to 25 cents per gallon of downside for local gas prices,"" tom kloza, opis global head of energy analysis, told yahoo finance on tuesday.
the us is also witnessing a weaker trend in fuel consumption following a 2023 high in prices reached in mid-september.
""gasoline demand has been weak,"" said the eia's barron. ""depending on which week you’re looking at it’s actually fallen below 2020 levels.""
crude oil prices spiked last week amid fears the israel-hamas war could broaden to other countries — namely iran — a key global oil producer.
despite last week's gains, prices are still roughly 7% below their 2023 high reached on sept. 28.
""fundamentally...the crude market remains very healthy,"" rebecca babin, cibc private wealth energy trader, told yahoo finance live on monday. ""we are in a place where supply and demand are very closely balanced, if not in a slight deficit.""
oil surged in the third quarter of this year amid continued opec+ production cuts and unilateral reductions by saudi arabia, which are expected to continue through year-end.
""a lot of the view [on oil prices] hinges on what [opec+ does] next. i think they stand pat, and we continue to see crude trade really well supported in that low-$80s range,"" babin said.
""[if] we get into the $90s we do start to worry about demand destruction, which i think is a very real thing.""
ines ferre is a senior business reporter for yahoo finance. follow her on twitter at @ines_ferre.
click here for in-depth analysis of the latest stock market news and events moving stock prices.
read the latest financial and business news from yahoo finance"
taylor swift's eras tour film delivers nearly $100 million domestic debut,2023-10-16T17:40:02.000Z,Alexandra Canal,"""taylor swift: the eras tour"" movie debuted at no. 1 at the box office over the weekend, nabbing $92.8 million in domestic ticket sales, according to final estimates released by amc (amc) on monday.
the concert film captured an additional $30.7 million overseas, the theater chain said, making it the best debut of all time for any concert film, in addition to the second-best domestic opening weekend for the month of october following 2019's ""joker.""
adding on to records, the film delivered $13 million globally for imax (imax), resulting in the biggest imax opening ever for a film by a musical artist — concert or documentary.
""it's really kind of an outside-the-box approach to moviegoing right now and something that i think we could see more of going forward,"" shawn robbins, chief analyst at box office pro, told yahoo finance live on monday.
despite the solid showing, amc and cinemark stock (cnk) moved lower in afternoon trading on monday, sinking about 1.5% and 3%, respectively. imax shares traded mostly flat.
the release of the film comes at a critical time for theaters as the nearly five-month-long writers strike caused multiple disruptions to the release schedule. most notably, warner bros.' (wbd) ""dune"" sequel was delayed to march 2024 after it was originally scheduled for november 2023.
other studios have also reshuffled their respective programming slates with hollywood actors still on the picket lines. the union, sag-aftra, accused the alliance of motion picture and television producers (amptp) of ""bullying tactics"" after talks between the two sides broke down over viewership bonuses and regulations surrounding ai.
the amptp bargains on behalf of the major studios including warner bros. (wbd), disney (dis), netflix (nflx), amazon (amzn), apple (aapl), nbcuniversal (cmcsa), paramount (para), and sony (sony).
""this is a weekend theater owners have been very thankful for in the wake of a few delays caused by the writers and actors strikes over recent months,"" robbins said.
""here we are talking about an almost $100 million opening weekend that was basically created out of thin air. this is not something that was on the industry's radar just as recently as the end of summer.""
the film's debut serves as the third-best opening weekend so far this year, behind mattel (mat) and warner bros.' ""barbie"" and disney's ""the little mermaid."" it was also able to edge out universal's ""oppenheimer,"" which delivered just over $82 million in its july debut.
robbins said the film will help the industry achieve its $9 billion domestic box office target by the end of this year. so far, the box office has collected more than $7 billion in sales, according to box office mojo.
and it's not just taylor swift releasing a concert film. a new film about beyoncé’s renaissance world tour will debut in theaters this december — a sign that more concert films could be heading to the big screen.
""taylor has certainly shown what's possible with a concert film when given a true wide release in close to 4,000 theaters, but she's also a hard act to follow,"" the analyst explained.
""we saw a wave of similar films hit cinemas a little over one decade ago. there's no question that they can provide exhibitors with a great source of alternative revenue during slower periods on the hollywood release calendar,"" he continued.
alexandra canal is a senior reporter at yahoo finance. follow her on twitter @allie_canal, linkedin, and email her at alexandra.canal@yahoofinance.com.
click here for the latest stock market news and in-depth analysis, including events that move stocks
read the latest financial and business news from yahoo finance"
first woman to lead germany’s biggest union takes aim at tesla,2023-10-21T05:00:00.000Z,William Wilkes and Monica Raymunt,"(bloomberg) -- the incoming first female head of germany’s most powerful labor union ig metall is warning elon musk about efforts to avoid unionization at his tesla inc. factory near berlin.
most read from bloomberg
israel latest: biden sees israel-saudi thaw as motive for attack
intel, siemens pull out of web summit after israel remarks
singapore dollar at all-time high against ringgit on policy gap
here’s what 8% mortgage rates will do to the housing market
us presses israel to delay gaza invasion to get hostages out
“you need to be careful. the rules of the game are different here,” said christiane benner, who is set to take the helm of the union on monday at its general assembly in frankfurt.
the warning is a shot across the bow for musk, whose factory churns out the popular model y — europe’s best-selling car earlier this year — and has so far refused to sign the kind of wage agreements that are standard in germany, putting the company on a collision course with benner.
ig metall has the power to initiate walkouts at some of germany’s biggest firms, including airbus, siemens, volkswagen and other titans of industry. wage negotiations for its 3.9 million workers are closely watched by european central bank due to their potential impact on inflation.
while tesla’s 12,000-employee plant is a key concern, benner, speaking in an interview with bloomberg news, outlined a broad set of worrying developments putting pressure on germany’s workers.
weaker demand from china, higher interest rates and the lingering fallout from last year’s energy crisis have already caused some factories to close and others to shift production abroad. the economy is forecast to shrink this year. at the same time, the transition to renewable energy and other emerging technologies are requiring workers to have new sets of skills.
“things are very turbulent at the moment,” benner said. “re-qualification is going to be very important.”
read more: german industrial production shrinks for fourth month
ig metall is europe’s biggest manufacturing union, representing workers on automaker assembly lines, steelmaking mills and other factories. the organization takes in about €500 million in annual membership fees and has repeatedly caused stoppages at germany’s most famous firms. with its vast membership, the organization holds considerable political clout.
benner, 55, argues that german politicians have been too slow in tackling the country’s structural issues, putting at risk workers in industries like auto production, which employs roughly 800,000 people.
a growing number of auto-industry workers in and outside of germany are demanding better pay and job security in the shift to electric vehicles. the united auto workers union has launched a major strike targeting general motors, ford and stellantis in the us, halting output at several factories. the concern is that evs, which require fewer moving parts and workers to make, will cost jobs and reduce wages.
read more: uaw and gm inch toward tentative deal, union negotiator says
in germany, growing voter frustration has fueled the rise of the far-right alternative for germany — known as the afd — which benner sees as a threat to the country’s push to reset its manufacturing base for the green economy. the party, which gained in recent state elections in bavaria and hesse, has objected to technologies such as heat pumps, undermining efforts to attract investors and establish industrial clusters for manufacturing the machines. and its avowedly anti-immigrant position threatens to worsen germany’s longstanding worker shortage.
“people need confidence. they need a plan and they need to see strategies. they need strong unions,” benner said. “we see it as our role to push back against this political fragmentation and polarization.”
her rise at the overwhelmingly male ig metall is remarkable. and alongside volkswagen works council chief daniela cavallo, who is leading the fight against painful cutbacks, it reflects a broader shift in germany’s traditionally male-dominated workers’ leadership.
german rules requires 50% employee representation on the supervisory boards of large corporations — a requirement some have blamed for slow restructuring at troubled firms like volkswagen and thyssenkrupp ag. benner disagrees.
“we can see that when we really push things and present good concepts to companies and governments, good things happen,” benner said.
that’s the message she aims to deliver to tesla, where more than 1,000 staff showed up at the ev-maker’s plant in gruenheide near berlin earlier this month wearing stickers calling for “safe and fair work,” ig metall said. tesla employees are complaining about poor conditions and safety hazards, including extreme workloads due to staff shortages and overly ambitious production targets, according to the union. tesla said the plant has regular checks by local authorities and that safety measures were being respected, according to reuters.
read more: tesla staff push for safe and fair work in germany, union says
benner hopes to sit down soon with the world’s richest man.
“elon, what’s the problem?” benner said. “i’m so friendly, i’ll bring cookies.”
most read from bloomberg businessweek
lululemon’s founder is racing to cure the rare disease destroying his muscles
the ozempic effect is coming for everything from kidney to heart disease treatments
inflation raging at 130% is pushing argentina down a radical path
jeep’s jump to $100,000 suvs risks leaving loyal buyers behind
the price of money is going up, and it’s not because of the fed
©2023 bloomberg l.p."
